original,replacement,edited
Faerie Slingshot,600000000,false
Ice Dice,500000000,false
Bottle Of Magic Sand,250000000,false
Wand of the Dark Faerie,280000000,false
Ghostkersword,230000000,false
Greater Staff of the Earth Faerie,200000000,false
Thyoras Tear,200000000,false
Leaded Elemental Vial,100000000,false
Bony Grarrl Club,55000000,false
Blaze,Inflation Notice,false
Clawed Shield,30000000,false
Triple Turbo Dryer,30000000,false
Fire and Ice Blade,25000000,false
Superior Reflection Shield,25000000,false
Focus of Imminent Destruction,24000000,false
Flame Reflectozap,20000000,false
Mega U-Bend,20000000,false
Ubikiberry Bag,20000000,false
Maractite Dimensional Trap,13000000,false
Ultimate Dark Reflectorb,17000000,false
Sword of Lameness,15500000,false
Acara Transmogrification Potion,15000000,false
Desert Lutari Morphing Potion,15000000,false
Extra Loud Techo Fanatic Megaphone,15000000,false
Fan of Swords,15000000,false
Stealthy Lutari Morphing Potion,15000000,false
Gemmed Sword of Light,14000000,false
Royal Wedding Ring,13000000,false
Ultra Dual Shovel,14000000,false
Pirate Captains Cutlass,13000000,false
Illusens Staff,10000000,false
Lutari Transmogrification Potion,12000000,false
Twin Faerie Blades,11500000,false
Glittery Faerie Dust,11000000,false
Maraquan Kacheek Morphing Potion,10000000,false
A Shovel,10000000,false
Air Faerie Crown,10000000,false
Faerie Ixi Morphing Potion,8000000,false
Faerie Lutari Morphing Potion,10000000,false
Grey Draik Morphing Potion,8000000,false
Hubrids Puzzle Box,10000000,false
Rainbow Scorchstone,10000000,false
Sword of Ari,10000000,false
Sword of Reif,10000000,false
Sword of Skardsen,10000000,false
Sword of Thigl,10000000,false
Sword of Thare,9250000,false
Cloak of the Night,8000000,false
Faerie Shoyru Morphing Potion,9000000,false
Hissi Transmogrification Potion,9000000,false
Plushie Aisha Morphing Potion,9000000,false
Plushie Cybunny Morphing Potion,9000000,false
Potion of Healing,9000000,false
Wheel Shield,9000000,false
Combo Battle Mirror,8000000,false
Maraquan Cybunny Morphing Potion,8000000,false
Pink Lutari Morphing Potion,8000000,false
Slumberberry Potion,8000000,false
Kelpbeards Trident,7800000,false
Island Lutari Morphing Potion,8000000,false
Maraquan Gelert Morphing Potion,7000000,false
Pirate Lutari Morphing Potion,11000000,false
Hubrid Nox Memorial Shield,7400000,false
Faerie Tabard,7300000,false
Ghostkerbomb,7200000,false
Green Lutari Morphing Potion,7000000,false
Heavy Blue Tunic,7000000,false
Kauvaras Potion,7000000,false
Maraquan Krawk Morphing Potion,8000000,false
Plushie Hissi Morphing Potion,6000000,false
Werelupe Claw Necklace,(r200),false
Ghostkershield,6500000,false
Grey Cybunny Morphing Potion,15000000,false
Grey Ixi Morphing Potion,6500000,false
Ultra Bubble Gun,6500000,false
Cybunny Transmogrification Potion,6000000,false
Faerie Cybunny Morphing Potion,6000000,false
Faerie Poogle Morphing Potion,6000000,false
Halloween Cybunny Morphing Potion,6000000,false
Plushie Grundo Morphing Potion,6000000,false
Plushie Jetsam Morphing Potion,6000000,false
Skarls Hasty Mace,6000000,false
Stealthy Krawk Morphing Potion,6000000,false
Wraith Draik Morphing Potion,6000000,false
Zombie Cybunny Morphing Potion,Inflation Notice,false
Faerie Draik Morphing Potion,5500000,false
Strange Potion,6000000,false
Camouflage Cybunny Morphing Potion,5000000,false
Chomby Transmogrification Potion,5000000,false
Christmas Cybunny Morphing Potion,6000000,false
Coltzans Diadem,5000000,false
Darigan Draik Morphing Potion,6000000,false
Draik Enhancement Brew,2000000,false
Faerie Grundo Morphing Potion,5000000,false
Faerie Peophin Morphing Potion,5000000,false
Green Cybunny Morphing Potion,5000000,false
Invisible Wocky Morphing Potion,3000000,false
Island Cybunny Morphing Potion,6000000,false
Jetsam Transmogrification Potion,5000000,false
Maraquan Ixi Morphing Potion,5000000,false
Plushie Gnorbu Morphing Potion,5000000,false
Plushie Kougra Morphing Potion,5000000,false
Plushie Usul Morphing Potion,4000000,false
Poogle Transmogrification Potion,5000000,false
Red Cybunny Morphing Potion,5000000,false
Shadow Cybunny Morphing Potion,5000000,false
Speckled Cybunny Morphing Potion,9000000,false
Spyder Potion,(r101),false
Starry Cybunny Morphing Potion,Inflation Notice,false
Vandagyre Transmogrification Potion,3500000,false
Faerie Ruki Morphing Potion,4000000,false
Yellow Cybunny Morphing Potion,4800000,false
Glowing Battle Dung,4500000,false
Halloween Hissi Morphing Potion,4000000,false
Icy Chia Goggles,4500000,false
Kau Transmogrification Potion,4500000,false
Plushie Bori Morphing Potion,4500000,false
Plushie Grarrl Morphing Potion,3500000,false
Plushie Korbat Morphing Potion,4500000,false
Stealthy Blumaroo Morphing Potion,4500000,false
Woodland Cybunny Morphing Potion,Inflation Notice,false
Wraith Shoyru Morphing Potion,4500000,false
Faerie Meerca Morphing Potion,4300000,false
Pirate Captains Hat,4200000,false
Baby Draik Morphing Potion,4000000,false
Blue Cybunny Morphing Potion,4000000,false
Chia Mites,3000000,false
Darigan Skeith Tongue,4000000,false
Faerie Bori Morphing Potion,4000000,false
Faerie Lupe Morphing Potion,6000000,false
Faerie Pteri Morphing Potion,4000000,false
Faerie Xweetok Morphing Potion,3500000,false
Ghost Gelert Morphing Potion,3000000,false
Golden Peophin Harp,4000000,false
Grape Jelly Sword,5000000,false
Ixi Transmogrification Potion,4000000,false
Lenny Transmogrification Potion,4000000,false
Magical Marbles of Mystery,4000000,false
Maraquan Grarrl Morphing Potion,4000000,false
Maraquan Meerca Morphing Potion,4000000,false
Maraquan Usul Morphing Potion,4000000,false
Plushie Chomby Morphing Potion,4000000,false
Plushie Kiko Morphing Potion,3800000,false
Plushie Skeith Morphing Potion,4000000,false
Purple Draik Morphing Potion,4000000,false
Rainbow Cybunny Morphing Potion,6000000,false
Ring of the Lost,4000000,false
Royal Girl Kyrii Morphing Potion,4000000,false
Wraith Krawk Morphing Potion,4800000,false
Xweetok Transmogrification Potion,3600000,false
Desert Aisha Morphing Potion,3500000,false
Desert Krawk Morphing Potion,3500000,false
Faerie Hissi Morphing Potion,2600000,false
Grey Yurble Morphing Potion,4000000,false
H4000 Helmet,2000000,false
Korbat Transmogrification Potion,6000000,false
Maraquan Acara Morphing Potion,3500000,false
Maraquan Korbat Morphing Potion,3500000,false
Maraquan Mynci Morphing Potion,3500000,false
Red Kacheek Morphing Potion,3500000,false
Yellow Kacheek Morphing Potion,5000000,false
Halloween Uni Morphing Potion,3400000,false
Wocky Transmogrification Potion,2600000,false
Baby Aisha Morphing Potion,3000000,false
Grey Mynci Morphing Potion,3200000,false
Krawk Transmogrification Potion,3200000,false
Pastel Xweetok Morphing Potion,3200000,false
Peophin Transmogrification Potion,3200000,false
Wraith Gelert Morphing Potion,3200000,false
Baby Jetsam Morphing Potion,3000000,false
Baby Kau Morphing Potion,3000000,false
Baby Kougra Morphing Potion,3000000,false
Bracelet of Kings,(r200),false
Darigan Kau Morphing Potion,3000000,false
Desert Blumaroo Morphing Potion,2500000,false
Disco Kacheek Morphing Potion,3000000,false
Everlasting Crystal Apple,3000000,false
Faerie Fog,2500000,false
Freezing Potion,2000000,false
Green Gelert Morphing Potion,2000000,false
Green Kacheek Morphing Potion,3000000,false
Grey Korbat Morphing Potion,3000000,false
Grey Techo Morphing Potion,3000000,false
Grey Zafara Morphing Potion,Inflation Notice,false
Halloween Aisha Morphing Potion,3000000,false
Halloween Grundo Morphing Potion,3000000,false
Halloween Kau Morphing Potion,3000000,false
Maractite Hissi Morphing Potion,3000000,false
Maractite Krawk Morphing Potion,2500000,false
Maraquan Techo Morphing Potion,3000000,false
Plushie Ixi Morphing Potion,3000000,false
Plushie Yurble Morphing Potion,3000000,false
Pteri Transmogrification Potion,2600000,false
Rainbow Swirly Potion,3000000,false
Red Jetsam Morphing Potion,3000000,false
Shield of Faerieland,2500000,false
Short Sleeved Yellow Tunic,1700000,false
Skeith Transmogrification Potion,3000000,false
Spotted Gelert Morphing Potion,3000000,false
Spotted Jetsam Morphing Potion,3000000,false
Spotted Kau Morphing Potion,3000000,false
Starry Kacheek Morphing Potion,3000000,false
Stealthy Kyrii Morphing Potion,3000000,false
Striped Jetsam Morphing Potion,4000000,false
Varia is the Bomb,3000000,false
White Ixi Morphing Potion,2500000,false
Chilli Sword,2900000,false
Fire Blumaroo Morphing Potion,2600000,false
Plushie Buzz Morphing Potion,2800000,false
Plushie Kau Morphing Potion,2800000,false
Woodland Uni Morphing Potion,3000000,false
Cloud Gelert Morphing Potion,2000000,false
Jhudoras Crystal Ball,2700000,false
Desert Kacheek Morphing Potion,2600000,false
Fire Kacheek Morphing Potion,3000000,false
Kougra Transmogrification Potion,2600000,false
Pirate Kacheek Morphing Potion,3000000,false
Portable Kiln,2600000,false
Apple Chia Morphing Potion,2500000,false
Baby Kacheek Morphing Potion,3000000,false
Faerie Acara Morphing Potion,2500000,false
Faerie Techo Morphing Potion,2500000,false
Ghost Hissi Morphing Potion,2000000,false
Green Chia Morphing Potion,2500000,false
Green Draik Morphing Potion,2500000,false
Green Jetsam Morphing Potion,2500000,false
Grey JubJub Morphing Potion,2500000,false
Island Gelert Morphing Potion,2500000,false
Island Kacheek Morphing Potion,2500000,false
Maractite Draik Morphing Potion,2500000,false
Purple Chia Morphing Potion,2400000,false
Speckled Kau Morphing Potion,2500000,false
Spotted Lupe Morphing Potion,2500000,false
Darigan Acara Morphing Potion,2400000,false
Darigan Wocky Morphing Potion,2400000,false
Faerie Kau Morphing Potion,2700000,false
Halloween Grarrl Morphing Potion,2400000,false
Stealthy Techo Morphing Potion,2400000,false
Woodland Draik Morphing Potion,2400000,false
Water Faerie Token,2000000,false
White Chia Morphing Potion,2250000,false
Aisha Transmogrification Potion,2000000,false
Baby Acara Morphing Potion,1800000,false
Baby Buzz Morphing Potion,2000000,false
Baby Chomby Morphing Potion,2000000,false
Baby Hissi Morphing Potion,2000000,false
Baby JubJub Morphing Potion,2000000,false
Baby Koi Morphing Potion,2000000,false
Baby Korbat Morphing Potion,2000000,false
Baby Meerca Morphing Potion,2000000,false
Baby Uni Morphing Potion,2000000,false
Bag of Lenny Healing Seeds,2000000,false
Blue Chia Morphing Potion,2000000,false
Blue Gelert Morphing Potion,2000000,false
Blue Jetsam Morphing Potion,2000000,false
Blue Kau Morphing Potion,2000000,false
Blue Lupe Morphing Potion,2000000,false
Blue Usul Morphing Potion,2000000,false
Brown Ixi Morphing Potion,2000000,false
Camouflage Chia Morphing Potion,2000000,false
Camouflage Krawk Morphing Potion,2000000,false
Checkered Kiko Morphing Potion,2000000,false
Christmas Chia Morphing Potion,2000000,false
Christmas Gelert Morphing Potion,2000000,false
Christmas Kacheek Morphing Potion,2800000,false
Clay Aisha Morphing Potion,Inflation Notice,false
Crisp Blue Tunic,2000000,false
Darigan Aisha Morphing Potion,2000000,false
Darigan Blumaroo Morphing Potion,2000000,false
Darigan Grundo Morphing Potion,2000000,false
Darigan Ixi Morphing Potion,2000000,false
Darigan Zafara Morphing Potion,Inflation Notice,false
Desert Chia Morphing Potion,(r98),false
Desert Hissi Morphing Potion,2000000,false
Dimensional Jetsam Morphing Potion,Inflation Notice,false
Dusty Magic Broom,2000000,false
Eventide Hissi Morphing Potion,2000000,false
Faerie Blumaroo Morphing Potion,2000000,false
Faerie Bruce Morphing Potion,2000000,false
Faerie Lenny Morphing Potion,2000000,false
Faerie Usul Morphing Potion,2000000,false
Faerie Yurble Morphing Potion,2000000,false
Fire Chia Morphing Potion,2000000,false
Fire Draik Morphing Potion,2000000,false
Fire Faerie Token,2000000,false
Fire Ixi Morphing Potion,2000000,false
Flask of Rainbow Fountain Water,2000000,false
Golden Coltzan Statue,2000000,false
Green Kau Morphing Potion,2000000,false
Green Krawk Morphing Potion,2000000,false
Grey Grarrl Morphing Potion,2000000,false
Grey Sword,2000000,false
Halloween Blumaroo Morphing Potion,2000000,false
Halloween Bori Morphing Potion,1800000,false
Halloween Chia Morphing Potion,2000000,false
Halloween Eyrie Morphing Potion,2000000,false
Halloween Ixi Morphing Potion,2000000,false
Halloween Kyrii Morphing Potion,2000000,false
Halloween Xweetok Morphing Potion,2000000,false
Ice Scorchstone,2000000,false
Illusens Gems,2000000,false
Irritable Genie-in-a-Bottle,2000000,false
Island Bruce Morphing Potion,2000000,false
Island JubJub Morphing Potion,1900000,false
Island Krawk Morphing Potion,2000000,false
Island Lupe Morphing Potion,2000000,false
Island Quiggle Morphing Potion,2000000,false
Island Uni Morphing Potion,2000000,false
Lucky Uni Charm,2000000,false
Maractite Peophin Morphing Potion,2000000,false
Maraquan Hissi Morphing Potion,2000000,false
Pink Lenny Morphing Potion,2500000,false
Plushie Ogrin Morphing Potion,2000000,false
Plushie Tuskaninny Morphing Potion,2000000,false
Plushie Wocky Morphing Potion,2500000,false
Polkadot Tonu Morphing Potion,2000000,false
Rainbow Hissi Morphing Potion,2000000,false
Rainbow Kacheek Morphing Potion,2900000,false
Rainbow Kau Morphing Potion,2000000,false
Red Chia Morphing Potion,2000000,false
Red Gelert Morphing Potion,2000000,false
Red Usul Morphing Potion,2000000,false
Relic Chia Morphing Potion,3000000,false
Shadow Lenny Morphing Potion,2000000,false
Snow Chia Morphing Potion,2000000,false
Split Chia Morphing Potion,2000000,false
Spotted Koi Morphing Potion,2000000,false
Spotted Kougra Morphing Potion,2000000,false
Starry Draik Morphing Potion,2000000,false
Starry Kau Morphing Potion,2000000,false
Stealthy Grarrl Morphing Potion,2000000,false
Stone Foam Finger,2000000,false
Strawberry Kacheek Morphing Potion,2000000,false
Striped Chia Morphing Potion,2000000,false
Super Attack Bacon,Inflation Notice,false
Transparent Korbat Morphing Potion,2000000,false
Transparent Skeith Morphing Potion,2000000,false
Under and Overripe Avocado Bombs,Inflation Notice,false
Water Acara Morphing Potion,2000000,false
Water Draik Morphing Potion,2000000,false
Water Kau Morphing Potion,2000000,false
White Xweetok Morphing Potion,2000000,false
Woodland Bori Morphing Potion,2000000,false
Woodland Koi Morphing Potion,2000000,false
Woodland Wocky Morphing Potion,2000000,false
Wraith Ogrin Morphing Potion,2000000,false
Wraith Pteri Morphing Potion,2000000,false
Yellow Draik Morphing Potion,2000000,false
Yellow Gelert Morphing Potion,2000000,false
Yellow Jetsam Morphing Potion,2000000,false
Yellow Kau Morphing Potion,2000000,false
Yurble Transmogrification Potion,2000000,false
Baby Chia Morphing Potion,1900000,false
Fire Lupe Morphing Potion,1900000,false
Green Lupe Morphing Potion,1900000,false
Island Hissi Morphing Potion,1900000,false
Jar of Spiders,1900000,false
Shadow Skeith Morphing Potion,965000,false
Baby Bruce Morphing Potion,1800000,false
Baby Gnorbu Morphing Potion,2000000,false
Darigan Mynci Morphing Potion,1800000,false
Desert Poogle Morphing Potion,(r99),false
Ghost Draik Morphing Potion,1800000,false
Grey Faerie Axe,1800000,false
Grey Lenny Morphing Potion,1700000,false
Halloween Lenny Morphing Potion,1400000,false
Island Grundo Morphing Potion,1800000,false
Plushie Techo Morphing Potion,1800000,false
Shadow Peophin Morphing Potion,1800000,false
Shadow Ruki Morphing Potion,2000000,false
Striped Shoyru Morphing Potion,1800000,false
Wraith Grundo Morphing Potion,3500000,false
Yellow Chia Morphing Potion,1800000,false
Yellow Krawk Morphing Potion,1800000,false
Plushie Bruce Morphing Potion,7000000,false
Blue Krawk Morphing Potion,1700000,false
Electric Ixi Morphing Potion,1700000,false
Halloween Korbat Morphing Potion,1700000,false
Pastel Gnorbu Morphing Potion,1100000,false
Pink Draik Morphing Potion,1700000,false
Rainbow Lupe Morphing Potion,3000000,false
Shuriken,1500000,false
Transparent Lenny Morphing Potion,1500000,false
Wraith Scorchio Morphing Potion,1700000,false
Island Zafara Morphing Potion,1760000,false
Green Usul Morphing Potion,1600000,false
Purple Scorchstone,1600000,false
Striped Xweetok Morphing Potion,1600000,false
Yellow Hissi Morphing Potion,1600000,false
Baby Scorchio Morphing Potion,2000000,false
Blue Chomby Morphing Potion,1500000,false
Blue Zafara Morphing Potion,2000000,false
Bori Transmogrification Potion,1500000,false
Brown Bruce Morphing Potion,1500000,false
Chia Transmogrification Potion,1500000,false
Christmas Chomby Morphing Potion,1500000,false
Christmas Lupe Morphing Potion,1500000,false
Darigan Bori Morphing Potion,1500000,false
Darigan Buzz Morphing Potion,1500000,false
Darigan Eyrie Morphing Potion,1500000,false
Darigan Kyrii Morphing Potion,1500000,false
Darigan Techo Morphing Potion,1500000,false
Dimensional Aisha Morphing Potion,1500000,false
Elixir of the Pirate,1500000,false
Eventide Draik Morphing Potion,1500000,false
Faerie Quiggle Morphing Potion,1500000,false
Glowing Lupe Morphing Potion,1500000,false
Gnorbu Transmogrification Potion,1500000,false
Green Chomby Morphing Potion,1500000,false
Green Ixi Morphing Potion,1200000,false
Green Zafara Morphing Potion,1500000,false
Grundo Transmogrification Potion,1500000,false
Halloween Nimmo Morphing Potion,1400000,false
Island Bori Morphing Potion,2000000,false
Island Ixi Morphing Potion,1500000,false
Kaylas Super Special Potion,1500000,false
Maractite Aisha Morphing Potion,1500000,false
Maraquan Buzz Morphing Potion,1500000,false
Plushie Flotsam Morphing Potion,1500000,false
Purple Zafara Morphing Potion,1500000,false
Red Ixi Morphing Potion,1500000,false
Red Kiko Morphing Potion,1500000,false
Red Lupe Morphing Potion,Inflation Notice,false
Red Zafara Morphing Potion,1500000,false
Shadow Chomby Morphing Potion,2000000,false
Shadow Hissi Morphing Potion,2000000,false
Skunk Draik Morphing Potion,1500000,false
Skunk Lupe Morphing Potion,1500000,false
Snow Peophin Morphing Potion,1500000,false
Spotted Hissi Morphing Potion,1500000,false
Squishy Shoyru Healing Stone,1500000,false
Usul Transmogrification Potion,1500000,false
Water Usul Morphing Potion,1500000,false
Wraith Korbat Morphing Potion,2000000,false
Yellow Chomby Morphing Potion,2000000,false
Yellow Kiko Morphing Potion,1500000,false
Yellow Lupe Morphing Potion,1500000,false
Yellow Usul Morphing Potion,1500000,false
Yellow Zafara Morphing Potion,1500000,false
Christmas Kiko Morphing Potion,1400000,false
Eventide Ixi Morphing Potion,999999,false
Island Usul Morphing Potion,1400000,false
Mysterious Swirly Potion,1400000,false
Pink Ruki Morphing Potion,1400000,false
Red Draik Morphing Potion,1400000,false
Red Kau Morphing Potion,1400000,false
Red Krawk Morphing Potion,1400000,false
Snow Usul Morphing Potion,1400000,false
Transparent Elephante Morphing Potion,1400000,false
Altador Strength Potion,1300000,false
Baby Usul Morphing Potion,2000000,false
Blade of Supernova,1300000,false
Disco Chomby Morphing Potion,1300000,false
Dr. Sloths Personal Bath Buddy,1300000,false
Eventide Aisha Morphing Potion,1300000,false
Faerie Aisha Morphing Potion,1300000,false
Halloween Meerca Morphing Potion,1300000,false
Island Poogle Morphing Potion,1300000,false
Rainbow JubJub Morphing Potion,1300000,false
Revive Potion,1300000,false
Sledge Shield,1300000,false
Starry Zafara Morphing Potion,1300000,false
Apple Jelly Club,1250000,false
JubJub Transmogrification Potion,975000,false
Sorcerers Potion Set,1100000,false
Blade of Ultranova,Inflation Notice,false
Christmas Zafara Morphing Potion,1500000,false
Elixir of Levelling,1200000,false
Eventide Zafara Morphing Potion,1200000,false
Fire Kau Morphing Potion,2000000,false
Meerca Transmogrification Potion,999999,false
Neovian Strength Potion,1200000,false
Nimmo Transmogrification Potion,1200000,false
Ogrin Transmogrification Potion,1200000,false
Pirate Usul Morphing Potion,1200000,false
Potion of Strategic Maneuvers,655000,false
Ruki Transmogrification Potion,1200000,false
Strawberry Lupe Morphing Potion,Inflation Notice,false
Striped Ixi Morphing Potion,850000,false
Tuskaninny Transmogrification Potion,1200000,false
Blade of the Battle Faerie,1100000,false
Bruce Transmogrification Potion,1100000,false
Faerie JubJub Morphing Potion,1100000,false
Potion of Dexterity,1100000,false
Quiggle Transmogrification Potion,1100000,false
Scroll Potion,1100000,false
Shoyru Transmogrification Potion,1100000,false
The Mystical Tablet,1200000,false
Void Blade,2000000,false
Sleep Ray,1200000,false
Altador Cup Throwing Star,(r101),false
Blue Poogle Morphing Potion,945000,false
Christmas Acara Morphing Potion,785000,false
Cloud Ruki Morphing Potion,999999,false
Darigan Quiggle Morphing Potion,999999,false
Disco Acara Morphing Potion,985000,false
Downsize Power Plus,999999,false
Fire Acara Morphing Potion,999999,false
Fire Ruki Morphing Potion,1200000,false
Ghost Acara Morphing Potion,999999,false
Ghost Shoyru Morphing Potion,1100000,false
Halloween Techo Morphing Potion,999999,false
Illusens Silver Shield,975000,false
Mynci Transmogrification Potion,999999,false
Pot of Darkness,999999,false
Potion of Doldrums,930000,false
Shadow Axe,1700000,false
Shadow Uni Morphing Potion,Inflation Notice,false
Starry Usul Morphing Potion,1300000,false
Tech Bow,999999,false
Uni Hoof Magnet,999999,false
Yellow Ixi Morphing Potion,980000,false
Fire Sceptre,999999,false
BattleGlowJewel,999999,false
Blumaroo Transmogrification Potion,990000,false
Brown Ruki Morphing Potion,1500000,false
Pirate Ixi Morphing Potion,930000,false
Shadow Korbat Morphing Potion,895000,false
Earth Faerie Token,999999,false
Island Wocky Morphing Potion,985000,false
Blue Acara Morphing Potion,980000,false
Pink Shoyru Morphing Potion,745000,false
Pirate Hissi Morphing Potion,243000,false
Air Sceptre,975000,false
Desert Mynci Morphing Potion,975000,false
Island Eyrie Morphing Potion,975000,false
Plushie Pteri Morphing Potion,995000,false
Disco Bruce Morphing Potion,970000,false
Strength Serum,735000,false
Checkered Acara Morphing Potion,965000,false
Cloud Grundo Morphing Potion,865000,false
Peophin Bubble,945000,false
Tyrannian Ixi Morphing Potion,815000,false
Pink Pteri Morphing Potion,980000,false
Woodland Mynci Morphing Potion,2000000,false
Grarrl Transmogrification Potion,745000,false
Blue Ruki Morphing Potion,1200000,false
Brown Uni Morphing Potion,915000,false
Green Ruki Morphing Potion,1500000,false
Faerie Tuskaninny Morphing Potion,915000,false
Scary Dark Potion,915000,false
Rainbow Grundo Morphing Potion,905000,false
Sinister Scythe,615000,false
Cloud Acara Morphing Potion,950000,false
Curved Wocky Sabre,980000,false
Green Skeith Morphing Potion,820000,false
Koi Transmogrification Potion,900000,false
Water Sceptre,999999,false
Green Acara Morphing Potion,Inflation Notice,false
Snowflake Pendant,Inflation Notice,false
Sunshine Shield,645000,false
Woodland Peophin Morphing Potion,895000,false
Earth Sceptre,955000,false
Fire Bori Morphing Potion,860000,false
Plushie Tonu Morphing Potion,870000,false
Yellow Acara Morphing Potion,999999,false
Woodland Grundo Morphing Potion,990000,false
Tonu Transmogrification Potion,880000,false
Aisha Totem,875000,false
Christmas Grundo Morphing Potion,999000,false
Eventide Kougra Morphing Potion,950000,false
Pink Peophin Morphing Potion,875000,false
Pirate Kougra Morphing Potion,999999,false
Plushie Mynci Morphing Potion,870000,false
Woodland Acara Morphing Potion,750000,false
Island Blumaroo Morphing Potion,970000,false
Buzz Transmogrification Potion,590000,false
Kyrii Transmogrification Potion,850000,false
Starry Ruki Morphing Potion,Inflation Notice,false
Blue Grundo Morphing Potion,670000,false
Christmas Kougra Morphing Potion,990000,false
Red Peophin Morphing Potion,835000,false
Swamp Gas Ogrin Morphing Potion,720000,false
Pirate Spear,455000,false
Cloud Peophin Morphing Potion,820000,false
Red Ruki Morphing Potion,Inflation Notice,false
Ghost Peophin Morphing Potion,999999,false
Baby Grundo Morphing Potion,935000,false
Jhudoras Bewitched Ring,620000,false
Yellow Ruki Morphing Potion,Inflation Notice,false
Desert Grundo Morphing Potion,999000,false
Greater Earthen Potion,690000,false
Palace Guard Sword,800000,false
Scorchio Transmogrification Potion,1500000,false
Kiko Transmogrification Potion,999999,false
Pirate Poogle Morphing Potion,790000,false
Rainbow Koi Morphing Potion,785000,false
Island Aisha Morphing Potion,940000,false
Green Hissi Morphing Potion,525000,false
Red Acara Morphing Potion,1500000,false
Cloud Bori Morphing Potion,760000,false
Desert Scorchio Morphing Potion,970000,false
Skarl Royal Flag,770000,false
Snow Bruce Morphing Potion,940000,false
Brown Grundo Morphing Potion,655000,false
Desert Yurble Morphing Potion,890000,false
Pirate Grundo Morphing Potion,795000,false
Slorg Flakes,765000,false
Starry Grundo Morphing Potion,725000,false
Baby Shoyru Morphing Potion,890000,false
Faerie Nimmo Morphing Potion,990000,false
Fire Xweetok Morphing Potion,990000,false
Uni Charm,740000,false
Padded Cybunny Sword,735000,false
White Skeith Morphing Potion,870000,false
Wraith Bruce Morphing Potion,705000,false
Baby Poogle Morphing Potion,600000,false
Desert Flotsam Morphing Potion,890000,false
Disco Shoyru Morphing Potion,975000,false
Black Long Sleeved Cape,770000,false
Light Sceptre,995000,false
Snow Blumaroo Morphing Potion,715000,false
Yellow Peophin Morphing Potion,750000,false
Baby Peophin Morphing Potion,865000,false
Blue Peophin Morphing Potion,855000,false
Potato Potion,700000,false
Energising Elixir,705000,false
Meridellian Potion of Defence,700000,false
Spotted Grundo Morphing Potion,700000,false
Cloud Ixi Morphing Potion,999999,false
Ghost Grarrl Morphing Potion,660000,false
Woodland Lenny Morphing Potion,700000,false
Brain Tree Knife,670000,false
Island Korbat Morphing Potion,665000,false
Air Faerie Token,770000,false
Baby Blumaroo Morphing Potion,765000,false
Dimensional Shoyru Morphing Potion,850000,false
Skarl Royal Crown,665000,false
Purple Grundo Morphing Potion,999999,false
Red Shoyru Morphing Potion,680000,false
Magic Tiki Mask,915000,false
Desert Peophin Morphing Potion,900000,false
